{
  "schemaVersion": 4,
  "documentType": "industrial.scene",
  "units": "m",
  "components": [
    {
      "id": "7ea70e68-e4fe-4695-92ff-44ae1c2f5d9a",
      "type": "pipe",
      "position": {
        "x": -2,
        "y": 1,
        "z": 2
      },
      "rotation": {
        "x": 0,
        "y": 0,
        "z": 0,
        "w": 1
      },
      "scale": {
        "x": 1,
        "y": 1,
        "z": 1
      },
      "properties": {
        "length": 2
      }
    },
    {
      "id": "599284d5-b930-4356-b141-313b32d17962",
      "type": "tank",
      "position": {
        "x": -4.2,
        "y": 1.9000000000000001,
        "z": 2
      },
      "rotation": {
        "x": 0,
        "y": 0,
        "z": 0,
        "w": 1
      },
      "scale": {
        "x": 1,
        "y": 1,
        "z": 1
      },
      "properties": {
        "level": 57,
        "temperature": 0
      }
    },
    {
      "id": "387d9686-87ee-4b6d-93f1-6c9685aec88f",
      "type": "pump",
      "position": {
        "x": -0.4,
        "y": 1,
        "z": 2
      },
      "rotation": {
        "x": 0,
        "y": 0,
        "z": 0,
        "w": 1
      },
      "scale": {
        "x": 1,
        "y": 1,
        "z": 1
      },
      "properties": {}
    },
    {
      "id": "27f2fdec-fd9b-4a80-a552-71e439ef4963",
      "type": "pipe",
      "position": {
        "x": -0.10000000000000012,
        "y": 2.1,
        "z": 2
      },
      "rotation": {
        "x": 0.5,
        "y": 0.5,
        "z": 0.4999999999999999,
        "w": 0.5000000000000001
      },
      "scale": {
        "x": 1,
        "y": 1,
        "z": 1
      },
      "properties": {
        "length": 1
      }
    },
    {
      "id": "5e795ebd-6021-445a-a1be-2b70fbb73160",
      "type": "tank",
      "position": {
        "x": 1.3289999999999997,
        "y": 2.029,
        "z": 1.9999999999999993
      },
      "rotation": {
        "x": 0,
        "y": 2.3551386880256624e-16,
        "z": -1.1102230246251568e-16,
        "w": 1
      },
      "scale": {
        "x": 1,
        "y": 1,
        "z": 1
      },
      "properties": {
        "level": 45,
        "temperature": 90
      }
    },
    {
      "id": "a4fe8c7d-2da7-421f-9dcf-f019043c7de4",
      "type": "elbow",
      "position": {
        "x": -0.09999999999999987,
        "y": 2.829,
        "z": 2
      },
      "rotation": {
        "x": 0.7071067811865476,
        "y": 0.7071067811865474,
        "z": -2.4503807662796213e-16,
        "w": -8.802883075958474e-17
      },
      "scale": {
        "x": 1,
        "y": 1,
        "z": 1
      },
      "properties": {}
    },
    {
      "id": "23e5e29b-d22a-4ab2-977c-811cb829b6b7",
      "type": "tee",
      "position": {
        "x": -5.543,
        "y": 2.7,
        "z": 2
      },
      "rotation": {
        "x": 0.5000000000000001,
        "y": 0.5000000000000002,
        "z": -0.49999999999999983,
        "w": 0.4999999999999999
      },
      "scale": {
        "x": 1,
        "y": 1,
        "z": 1
      },
      "properties": {}
    },
    {
      "id": "701a8e06-67d0-44cd-8e96-82951c55e4bf",
      "type": "pipe",
      "position": {
        "x": -5.543,
        "y": 2.6999999999999997,
        "z": 3.143
      },
      "rotation": {
        "x": 2.1588771306901904e-16,
        "y": -0.7071067811865476,
        "z": -2.158877130690191e-16,
        "w": 0.7071067811865475
      },
      "scale": {
        "x": 1,
        "y": 1,
        "z": 1
      },
      "properties": {
        "length": 2
      }
    },
    {
      "id": "f0884444-0934-4eb5-aec4-240aa340c233",
      "type": "elbow",
      "position": {
        "x": -5.543,
        "y": 2.7,
        "z": 1.6280000000000001
      },
      "rotation": {
        "x": 2.1588771306901904e-16,
        "y": 0.7071067811865476,
        "z": 2.158877130690191e-16,
        "w": 0.7071067811865475
      },
      "scale": {
        "x": 1,
        "y": 1,
        "z": 1
      },
      "properties": {}
    },
    {
      "id": "e078f9ff-8fcd-4446-839b-0a4371a899a3",
      "type": "elbow",
      "position": {
        "x": -5.543,
        "y": 2.6999999999999993,
        "z": 4.372
      },
      "rotation": {
        "x": -0.49999999999999994,
        "y": -0.4999999999999998,
        "z": -0.5000000000000003,
        "w": 0.5
      },
      "scale": {
        "x": 1,
        "y": 1,
        "z": 1
      },
      "properties": {}
    },
    {
      "id": "5e436f79-da8b-4e5f-8868-0bcb19186c16",
      "type": "pipe",
      "position": {
        "x": -4.814,
        "y": 2.6999999999999993,
        "z": 4.372
      },
      "rotation": {
        "x": 0,
        "y": -8.326672684688674e-17,
        "z": -2.220446049250313e-16,
        "w": 1
      },
      "scale": {
        "x": 1,
        "y": 1,
        "z": 1
      },
      "properties": {
        "length": 1
      }
    },
    {
      "id": "300597ae-b83c-44d6-9538-e7e47b8ce870",
      "type": "tank",
      "position": {
        "x": -3.1140000000000008,
        "y": 1.8999999999999986,
        "z": 4.372
      },
      "rotation": {
        "x": 0,
        "y": -8.326672684688674e-17,
        "z": -2.220446049250313e-16,
        "w": 1
      },
      "scale": {
        "x": 1,
        "y": 1,
        "z": 1
      },
      "properties": {
        "level": 45
      }
    }
  ],
  "connections": []
}
