{
  "schemaVersion": 4,
  "documentType": "industrial.scene",
  "units": "m",
  "components": [
    {
      "id": "T1",
      "type": "tank",
      "position": {
        "x": 0,
        "y": 0.5,
        "z": 0
      },
      "rotation": {
        "x": 0,
        "y": 0,
        "z": 0,
        "w": 1
      },
      "scale": {
        "x": 1,
        "y": 1,
        "z": 1
      },
      "properties": {}
    },
    {
      "id": "T1",
      "type": "valve",
      "position": {
        "x": 2,
        "y": 0.5,
        "z": 0
      },
      "rotation": {
        "x": 0,
        "y": 0,
        "z": 0,
        "w": 1
      },
      "scale": {
        "x": 1,
        "y": 1,
        "z": 1
      },
      "properties": {}
    }
  ],
  "connections": []
}
